{
  "schema_version": "1.0",
  "id": "scale_stress_full_v1",
  "description": "Publication scale-stress panel on a rounded, author-defined synthetic grid. The cases exercise separate and joint resource axes without representing or projecting any external dataset.",
  "seed_plan": "experiments/v1/seeds/seed-plan.json",
  "scale_grid": {
    "provenance": "author_defined_public_synthetic_grid",
    "cells": [1000, 5000, 10000],
    "genes": [5000, 20000, 25000],
    "transcription_factors": [250, 1250, 1500]
  },
  "expression_preparation": {
    "input_scale": "nonnegative_synthetic_counts_like",
    "normalization": "library-size-log1p",
    "target_sum": 10000.0,
    "library_size_scope": "all_generated_genes_before_any_filtering",
    "formula": "log1p(target_sum * raw_value / per_cell_library_size)"
  },
  "datasets": [
    {
      "id": "scale_stress_full_baseline",
      "design_role": {"kind": "synthetic_scale_case", "case_id": "baseline_balanced", "purpose": "Provide a rounded multi-group baseline for the large-scale stress panel."},
      "seed": 2110054968,
      "seed_derivation": {"namespace": "full.scalability", "stream": "augmentation", "coordinates": {"phase": "scalability", "dataset_id": "scale_stress_full_baseline", "augmentation_contract": "scale_stress_v1"}},
      "genes": 5000,
      "tfs": 250,
      "groups": [{"id": "state_1", "cells": 200}, {"id": "state_2", "cells": 300}, {"id": "state_3", "cells": 500}],
      "network_mode": "dynamic",
      "active_tf_fraction": 0.75,
      "regulated_target_fraction": 0.85,
      "low_detection_target_fraction": 0.15,
      "regulators_per_target": 3,
      "rewiring_fraction": 0.34,
      "base_dropout_probability": 0.65,
      "low_detection_dropout_probability": 0.93,
      "library_size_log_sd": 0.5,
      "latent_factors": 6,
      "noise_sd": 0.25
    },
    {
      "id": "scale_stress_full_cell_heavy",
      "design_role": {"kind": "synthetic_scale_case", "case_id": "cell_heavy", "purpose": "Stress the cell axis while holding the baseline gene and regulator counts fixed."},
      "seed": 1468772922,
      "seed_derivation": {"namespace": "full.scalability", "stream": "augmentation", "coordinates": {"phase": "scalability", "dataset_id": "scale_stress_full_cell_heavy", "augmentation_contract": "scale_stress_v1"}},
      "genes": 5000,
      "tfs": 250,
      "groups": [{"id": "state_1", "cells": 2000}, {"id": "state_2", "cells": 3000}, {"id": "state_3", "cells": 5000}],
      "network_mode": "dynamic",
      "active_tf_fraction": 0.75,
      "regulated_target_fraction": 0.85,
      "low_detection_target_fraction": 0.15,
      "regulators_per_target": 3,
      "rewiring_fraction": 0.34,
      "base_dropout_probability": 0.65,
      "low_detection_dropout_probability": 0.93,
      "library_size_log_sd": 0.5,
      "latent_factors": 6,
      "noise_sd": 0.25
    },
    {
      "id": "scale_stress_full_gene_heavy",
      "design_role": {"kind": "synthetic_scale_case", "case_id": "gene_heavy", "purpose": "Stress the gene axis while holding baseline regulator and cell counts fixed."},
      "seed": 464323448,
      "seed_derivation": {"namespace": "full.scalability", "stream": "augmentation", "coordinates": {"phase": "scalability", "dataset_id": "scale_stress_full_gene_heavy", "augmentation_contract": "scale_stress_v1"}},
      "genes": 25000,
      "tfs": 250,
      "groups": [{"id": "state_1", "cells": 200}, {"id": "state_2", "cells": 300}, {"id": "state_3", "cells": 500}],
      "network_mode": "dynamic",
      "active_tf_fraction": 0.75,
      "regulated_target_fraction": 0.85,
      "low_detection_target_fraction": 0.2,
      "regulators_per_target": 3,
      "rewiring_fraction": 0.34,
      "base_dropout_probability": 0.75,
      "low_detection_dropout_probability": 0.95,
      "library_size_log_sd": 0.55,
      "latent_factors": 8,
      "noise_sd": 0.3
    },
    {
      "id": "scale_stress_full_tf_heavy",
      "design_role": {"kind": "synthetic_scale_case", "case_id": "tf_heavy", "purpose": "Stress the regulator axis while holding baseline gene and cell counts fixed."},
      "seed": 504617460,
      "seed_derivation": {"namespace": "full.scalability", "stream": "augmentation", "coordinates": {"phase": "scalability", "dataset_id": "scale_stress_full_tf_heavy", "augmentation_contract": "scale_stress_v1"}},
      "genes": 5000,
      "tfs": 1500,
      "groups": [{"id": "state_1", "cells": 200}, {"id": "state_2", "cells": 300}, {"id": "state_3", "cells": 500}],
      "network_mode": "dynamic",
      "active_tf_fraction": 0.75,
      "regulated_target_fraction": 0.85,
      "low_detection_target_fraction": 0.15,
      "regulators_per_target": 3,
      "rewiring_fraction": 0.34,
      "base_dropout_probability": 0.65,
      "low_detection_dropout_probability": 0.93,
      "library_size_log_sd": 0.5,
      "latent_factors": 6,
      "noise_sd": 0.25
    },
    {
      "id": "scale_stress_full_joint_balanced",
      "design_role": {"kind": "synthetic_scale_case", "case_id": "joint_balanced", "purpose": "Exercise the joint upper grid corner with broadly balanced groups."},
      "seed": 2068479013,
      "seed_derivation": {"namespace": "full.scalability", "stream": "augmentation", "coordinates": {"phase": "scalability", "dataset_id": "scale_stress_full_joint_balanced", "augmentation_contract": "scale_stress_v1"}},
      "genes": 25000,
      "tfs": 1500,
      "groups": [{"id": "state_1", "cells": 3000}, {"id": "state_2", "cells": 3000}, {"id": "state_3", "cells": 4000}],
      "network_mode": "dynamic",
      "active_tf_fraction": 0.75,
      "regulated_target_fraction": 0.85,
      "low_detection_target_fraction": 0.2,
      "regulators_per_target": 3,
      "rewiring_fraction": 0.67,
      "base_dropout_probability": 0.8,
      "low_detection_dropout_probability": 0.96,
      "library_size_log_sd": 0.6,
      "latent_factors": 8,
      "noise_sd": 0.35
    },
    {
      "id": "scale_stress_full_joint_imbalanced",
      "design_role": {"kind": "synthetic_scale_case", "case_id": "joint_imbalanced", "purpose": "Exercise a rounded joint workload with a deliberately imbalanced group layout."},
      "seed": 1732455860,
      "seed_derivation": {"namespace": "full.scalability", "stream": "augmentation", "coordinates": {"phase": "scalability", "dataset_id": "scale_stress_full_joint_imbalanced", "augmentation_contract": "scale_stress_v1"}},
      "genes": 20000,
      "tfs": 1250,
      "groups": [{"id": "state_1", "cells": 100}, {"id": "state_2", "cells": 900}, {"id": "state_3", "cells": 4000}],
      "network_mode": "dynamic",
      "active_tf_fraction": 0.75,
      "regulated_target_fraction": 0.85,
      "low_detection_target_fraction": 0.2,
      "regulators_per_target": 3,
      "rewiring_fraction": 0.67,
      "base_dropout_probability": 0.75,
      "low_detection_dropout_probability": 0.95,
      "library_size_log_sd": 0.55,
      "latent_factors": 8,
      "noise_sd": 0.3
    },
    {
      "id": "scale_stress_full_invariant_control",
      "design_role": {"kind": "synthetic_control", "control_id": "joint_invariant", "purpose": "Separate scale cost from group-specific rewiring at the same rounded joint workload."},
      "seed": 1280653023,
      "seed_derivation": {"namespace": "full.scalability", "stream": "augmentation", "coordinates": {"phase": "scalability", "dataset_id": "scale_stress_full_invariant_control", "augmentation_contract": "scale_stress_v1"}},
      "genes": 20000,
      "tfs": 1250,
      "groups": [{"id": "state_1", "cells": 2500}, {"id": "state_2", "cells": 2500}],
      "network_mode": "invariant",
      "active_tf_fraction": 0.75,
      "regulated_target_fraction": 0.85,
      "low_detection_target_fraction": 0.15,
      "regulators_per_target": 3,
      "rewiring_fraction": 0.0,
      "base_dropout_probability": 0.65,
      "low_detection_dropout_probability": 0.93,
      "library_size_log_sd": 0.45,
      "latent_factors": 6,
      "noise_sd": 0.25
    }
  ]
}
